sen1_origin_id,sentence1,sen1_paraphrase0,sen1_paraphrase1,sen1_paraphrase2,sen1_task,sen2_origin_id,sentence2,sen2_paraphrase0,sen2_task
RTE1_dev.column_s1_177,Increased storage is n't all Microsoft will be offering its Hotmail users-they can also look forward to free anti-virus protection .,Increased storage space is not all Microsoft will offer its Hotmail users - they can also look forward to free antivirus protection.,Increased storage isn't all Microsoft will offer its Hotmail users - they can also look forward to free anti-virus protection.,Increased storage is not all Microsoft is offering its hotmail users - they can also look forward to free anti-virus protection.,RC,RTE3_dev.column_s1_457,"Even Homer realises the cleverness of Jan De Bont 's tautly-directed action . Laser Movies , Speed , Widescreen with Keanu Reeves , Dennis Hopper , Sandra Bullock .","Even Homer realizes the cleverness of Jan De Bont's tautly directed action : laser movies, Speed, Widescreen with Keanu Reeves, Dennis Hopper, Sandra Bullock.",QA
RTE1_dev.column_s1_606,"`` That film was n't too successful , but then ' WarGames , ' which was successful , came out right when I won the Tony for ' Brighton Beach ' in 1983 .","That film wasn't too successful but then'WarGames, which was successful, came out right when I won the Tony for'Brighton Beach'in 1983."," That film wasn't too successful, but then'WarGames'which was successful, came out right when I won the Tony for'Brighton Beach'in 1983.","The film was not too successful, but then'WarGames ', which was successful, came out right, when I won Tony for'Brighton Beach'in 1983.",QA,RTE3_dev.column_s1_791,"Attack helicopters , Chinooks , armoured vehicles , cranes and a fire engine encircled the group .","It encircled the group with attack helicopters, Chinooks, blind vehicles, cranes and a fire engine.",SUM
RTE1_dev.column_s1_178,Increased storage is n't all Microsoft will be offering its Hotmail users-they can also look forward to free anti-virus protection .,Increased storage isn't all Microsoft will offer to its Hotmail users - they can also look forward to free anti-virus protection.,Increased storage isn 't all Microsoft will offer its Hotmail users ; they can also look forward to free anti-virus protection.,Increased storage is not all Microsoft will offer its hotmail users- they can also look forward to free anti-virus protection.,RC,RTE3_dev.column_s1_790,"Forty-five percent of the bills examined were bipartisan , and 85 percent of the reviewed bills had Republican lead sponsors. 8221 ; Small business owners are disappointed by the Republican track record , particularly the lack of productivity in the Senate .","Forty-five percent of the bills examined were bipartisan, and 85 percent of the reviewed bills had Republican leaders. 8221 Small business owners are disappointed with the Republican record, especially the lack of productiveness in the Senate.",SUM
RTE3_dev.column_s1_436,"`` It 's a vote of confidence that the momentum is going to continue '' , Doyle said . The momentum also appears to be moving south . The Mexican election is the latest indication that the free-market reforms that have swept Latin America during the past decade are gaining political acceptance . In Brazil , prices rose sharply , reacting to the Mexico vote and to new polls favorable to free-market presidential candidate Fernando Henrique Cardoso .","The Mexican election is the latest indication that free-market reforms that have swept Latin America during the past decade are gaining political acceptance. Prices in Brazil rose sharply, reacting to the Mexico vote and new polls favorable to the Free-Market presidential candidate Fernando Henrique Cardoso.","The Mexican election is the latest indication that free-market reforms that have swept Latin America during the past decade are gaining political acceptance. In Brazil, prices rose sharply to react to the Mexico vote and to new polls favorable to free-market presidential candidate Fernando Henrique Cardoso.","The Mexican election is the latest indicator that the free-market reforms that have swept Latin America during the past decade are gaining political acceptance. In Brazil, prices rose sharply in response to the Mexico vote and to new polls favorable to free-market presidential candidate Fernando Henrique Cardoso.",QA,RTE3_dev.column_s1_416,"Since ' 82 Federal Chancellor ( elected by `` constructive vote of no confidence '' against former Chancellor Helmut Schmidt , Social Democratic Party ( SPD ) ; reelected 1983 , 1987 , 1991 and 1994 ) . This makes Helmut Kohl the longest-serving chancellor of the Federal Republic , passing by Konrad Adenauer , the first chancellor , this October .","Since '82 Federal Chancellor ( elected by  constructive vote of no confidence '' against former Chancellor Helmut Schmidt, Social Democratic Party ( SPD ) ; reelected 1983, 1987, 1991 and 1994 ) Helmut Kohl is the longest serving federal general chancellor, after Konrad Adenauer, the first prime minister, died in October.",QA
RTE3_dev.column_s1_380,"Then China rolled out the fake Panchen Lama , Gyaltsen Norbu , a teenager chosen as the reincarnation of a major lama by the atheist Communist leaders and trained since childhood to spout nationalist slogans while wearing robes . Newspapers reporting on the debacle generally tried to present both sides , but it seems fair to say there 's really only one side to this sham and that pretty much nobody in the Tibetan community accepts Norbu as the real Panchen Lama . The Dalai Lama 's choice for Panchen Lama , Gedhun Choekyi Nyima , has been in secret Chinese custody since 1995 .","Newspapers reporting on the debacle generally tried to present both sides but it seems fair to say there is really only one side to this sham and that pretty much nobody in the Tibetan community accepts Norbu as the real Panchen Lama, which the Dalai Lama has carved out since 1995 in secret Chinese custody.","Then China rolled out the false panchen Lama, Gyaltsen Norbu, a teenager chosen as a reincarnation of a major lama by the atheist Communist leaders and trained since childhood to say nationalist slogans while wearing robes. Newspapers reporting on the debacle generally tried to present both sides, but it seems fair to say that pretty much nobody in the Tibetan community accepts Norbu as the real Panchen Lama. The Dalai Lama","Then China rolled out the fake Panchen Lama, Gyaltsen Norbu, a teenager selected by the atheist - Communist leaders as reincarnation of a major lama, trained since childhood to spit nationalist slogans while wearing robes, but it seems fair to say there's actually only one side to this sham and that pretty much nobody in the Tibetan community accepts Norbu as the real Panchen Lama. The Dalai Lam",IR,RTE1_dev.column_s1_723,The city continued to grow through much of the 20 th century .,The city continued to grow through much of the 20th century.,CD
RTE3_dev.column_s1_354,"The International Olympic Committee has leapt to the defence of the drug-testing lab at the centre of the Merlene Ottey doping case . Athletics ' governing body , the IAAF , last week cleared Ottey of accusations of steroid use and lifted a two-year ban after their arbitration panel said the IOC-accredited lab in Lausanne improperly tested Ottey 's urine sample .","The International Olympic Committee leapt to defend the drug testing lab at the center of the Merlene Ottey Doping case. Athletics'governing body, the IAAF, cleared Ottey last week of accusations of steroids use and lifted a two-year ban after their arbitration panel said the IOC accredited lab in Lausanne improperly tested Ottey's urine sample.","The International Olympic Committee jumped to the defence of the drug testing lab at the centre of the Merlene Ottey doping case. The governing body of athletics, the IAAF, cleared Ottey of steroid allegations last week and lifted a two-year ban after their arbitration panel said the IOC accredited lab in Lausanne improperly tested Ottey's urine sample.","The International Olympic Committee has jumped to the defense of the drug lab at the center of the Merlene Ottey doping case. Last week, the athletics'governing body, the IAAF cleared Ottey of accusations of steroid use and lifted a two-year ban after their arbitration panel said the IOC-accredited lab in Lausanne improperly tested Ottey's urine sample.",IR,RTE3_dev.column_s1_582,"`` For Japanese yakuza , the most important thing is staying alive , and making money is second , '' the yakuza said ."," The most important thing for Japanese yakuza is survival, making money is second, '' said the yakuza.",QA
RTE3_dev.column_s1_204,"A former philosophy teacher whose best-known novel , Sophie 's World , was a surprise international best-seller .","A former philosophy teacher, whose best-known novel, Sophie's World, was an international bestseller.","A former philosophy teacher, whose best-known novel, Sophie's World, was an international bestselling mystery.","A former philosophy teacher whose most famous novel, Sophie's World, was a surprise international bestseller.",IR,RTE3_dev.column_s1_504,"Tintin , the Smurfs , Boule et Bill , Astrix , Natacha , Spirou and other legendary characters were created by talented artists like Herg , Morris , Franquin and Walthry .","By talented artists such as Herg, Morris, Franquin and Walthry, Tintin, the Smurfs, Boule et Bill, Astrix, Natacha, Spirou and other legendary characters, a legendary character was created.",QA
RTE3_dev.column_s1_249,"Elsewhere , Mozambique took its first ever Olympic gold medal when Maria Mutola won the women 's eight-hundred metres , while the men 's ten-thousand-metres went to the Ethiopian Haile Gebrselassie .","Elsewhere, Mozambique took its first Olympic gold medal when Maria Mutola won the eight-hundred meters of the women, while the ten-thousand-meters of the men went to Ethiopia's Haile Gebrselassie.","Elsewhere, Mozambique took its first Olympic gold medal when Maria Mutola won the eight-hundred meters of the women, while the 10-thousand-metres went to the Ethiopian Haile Gebrselassie.","Mozambique took its first Olympic gold medal there, when Maria Mutola won the eight-thousand-metre women, while the men's ten thousand-metres went to the Ethiopian Haile Gebrselassie.",IR,RTE3_dev.column_s1_521,"February 4 , 2005 , Iraq . With more than two-thirds of the 3.3 million votes counted in the Iraqi legislative election , the United Iraqi Alliance has a considerable lead over interim Iraqi Prime Minister Iyad Allawi 's Iraqi List which trails with approximately 17 % of the current tally .","With more than two-thirds of the 3.3 million votes counted in the Iraqi parliament election, the United Iraqi Alliance has a significant lead over interim Iraqi Prime Minister Iyad Allawi's Iraqi List which trails about 17 % of the current tally.",QA
RTE3_dev.column_s1_142,"They named themselves for Saint Joan of Arc . The brigade began with 17 women , but soon grew to 135 members . Its mission was to obtain money , weapons , provisions , and information for the combatant men . Many smuggled weapons into the combat zones by carrying them in carts filled with grain or cement .","The brigade began with 17 women, but soon expanded to 135 members ; its mission was to collect money, weapons, provisions and information for combatants, many smuggled weapons into the combat zones by carrying them in carts filled with grain or cement.","The brigade began with 17 women but grew quickly to 135 members. Its mission was to obtain money, weapons, provisions and information for combatants. Many smuggled weapons into combat zones by carrying them in carts filled with grain or cement.","The brigade began with 17 women, but soon grew to 135 members. Its mission was to obtain money, weapons, provisions and information for the combatants ; many smuggled weapons into combat zones by carrying them in carts filled with grains or cement.",IE,RTE1_dev.column_s1_570,"`` I guess you have to expect this in a growing community , '' said Mardelle Kean , who lives across the street from John Joseph Famalaro , charged in the death of Denise A. Huber , who was 23 when she disappeared in 1991 .","Mardelle Kean, who lives across the street from John Joseph Famalaro, is charged in the death of Denise A. Huber, who was 23 when she disappeared in 1991.",QA
RTE3_dev.column_s1_297,"Mr Gregory 's conclusion in 1994 was that the ceremony , transferred to the more convenient nearest Sunday , was dying out . However , that year the Conservative government proclaimed `` festivities '' to celebrate the 50 th anniversary of the Normandy landings .","The conclusion of Mr Gregory in 1994 was that the ceremony, moved to the more convenient Sunday, was dying out ; but that year, the Conservative government proclaimed  celebrations '' to celebrate the 50th anniversary of Normandy landings.","Mr Gregory's conclusion in 1994 was that the ceremony, transferred to the more convenient Sunday, was dying out but in this year the Conservative government proclaimed  festivities '' to celebrate the 50th anniversary of the Normandy landings.","In 1994, Mr Gregory's conclusion was that the ceremony, moved to the convenient Sunday, was dying out, but the Conservative government also declared in that year's celebrations to celebrate the 50th anniversary of Normandy landings.",IR,RTE3_dev.column_s1_294,"Mental health problems in children and adolescents are on the rise , the British Medical Association has warned , and services are ill-equipped to cope .","The British Medical Association has warned that mental health problems in children and adolescents are increasing, and services are inadequate to cope.",IR
RTE3_dev.column_s1_140,"George Hawi 's assassination came on the heels of the conclusion of the last round of parliamentary elections , which saw a coalition of opposition candidates led by Saad Hariri , son of former Prime Minister of Lebanon Rafik Hariri , capture a majority of seats .","George Hawi's assassination followed the end of the last round of parliamentary elections, during which a coalition of opposition candidates led by Saad Hariri, son of former prime minister of Lebanon Rafik Hariri, captured the majority of seats.","George Hawi's assassination occurred on the heels of the conclusion of the last round of parliamentary elections, where a coalition of opposition candidates led by Saad Hariri, son of former premier of Lebanon Rafik Hariri, captured a majority of seats.","George Hawi's assassination came to the end of the last round of parliamentary elections. A coalition of opposition candidates led by Saad Hariri, son of former prime minister of Lebanon Rafik Hariri, captured a majority of the seats.",IE,RTE3_dev.column_s1_411,"Although I come across Borges and Calvino fairly often , too , I have to admit that Gabriel Garcia Marquez is the only one of the other authors I am at all familiar with , so I am not sure which difference it might make . I would be curious , though , what that difference might look like to people writing about media art and architecture in Spanish , for example .","Although I occasionally meet Borges and Calvino, I have to admit that Gabriel Garcia Marquez is the only other author I am familiar with, so I am not sure what that difference might make. I would be curious, however, what that difference might look like for people writing in Spanish about media art and architecture.",QA
RTE3_dev.column_s1_332,"Stony Brook , NY ( 1 / 10 / 02 ) - The discovery of paleolithic art in a cave in South Africa is causing researchers to consider an older and less Euro-centric view of the origins of what is considered ' modern behavior ' .",The discovery of paleolithic art in a cave in South Africa is causing researchers to consider an older and less Euro-centric view of the origins of what is considered'modern behavior '.,The discovery of paleolithic art in a cave in South Africa causing researchers to consider an older and less Eurocentric view of what is considered to be'modern behavior '.,The discovery of paleolithic art in a cave in South Africa is causing researchers to reconsider an older and less Euro-centric view of what is considered'modern behavior '.,IR,RTE3_dev.column_s1_564,"Unwilling to surrender his dream of beginning a Holy Land pilgrimage in Iraq , Pope John Paul II made a `` virtual pilgrimage '' Wednesday to Ur , the ancient city that is traditionally held to be the birthplace of Abraham .","Unwilling to surrender his dream of an Israeli pilgrimage of the holy land in Iraq, Pope John Paul II had a  virtual pilgrimage '' to Ur, the ancient city traditionally believed to be Abraham's birthplace.",QA
RTE3_dev.column_s1_434,"November 9 , 1989 , the day the Berlin Wall fell and the world changed forever . Not even the most astute saw it coming . As Hungary 's foreign minister in the late summer of 1989 , Gyula Horn gave the order to let visiting East Germans use his country to do a 400-mile end run around the Berlin Wall , a move now seen as the beginning of the end for hard-line communism in Europe .","As Hungary's foreign minister in the late summer of 1989 Gyula Horn gave the order to allow visiting East Germans to build a 400-mile run around the Berlin Wall, a move now seen as the beginning of the end for hard-line communism in Europe.","In late summer 1989, Gyula Horn gave the order as Hungary's Foreign Minister to allow visiting East Germans to use his country to do a 400-mile round the Berlin Wall, a move now seen as the beginning of the end for hard-line communism in Europe.","As Hungary's foreign minister, Gyula Horn gave the order in late summer 1989 to allow visiting East Germans to use his country for a 400-mile long run around the Berlin Wall, a move now seen as the beginning of the end of hard-line communism in Europe.",QA,RTE3_dev.column_s1_390,"Typhoon Xangsane lashed the Philippine capital on Thursday , grounding flights , halting vessels and closing schools and markets after triggering fatal flash floods in the centre of the country .","On Thursday the typhoon Xangsane grounded the Philippine capital, cancelled flights, stopped vessels and closed schools and markets, after triggering fatal flash floods in the centre of the country.",IR
RTE3_dev.column_s1_71,"As leaders gather in Argentina ahead of this weekends regional talks , Hugo Chvez , Venezuela 's populist president is using an energy windfall to win friends and promote his vision of 21 st-century socialism .","As leaders gather in Argentina ahead of this weekend regional talks, Hugo Chvez, Venezuela's populist president uses an energy windfall to win friends and promote his vision of 21st-century socialism.","As leaders gather in Argentina ahead of the regional talks this weekend, Hugo Chvez, Venezuela's populist president, is using an energy windfall to win friends and promote his vision of 21st-century socialism.","As leaders gather in Argentina ahead of regional talks this weekend, Hugo Chvez, Venezuela's populist president, is using an energy win to win friends and promote his vision of 21st century socialism.",IE,RTE3_dev.column_s1_520,"Beamon 's jump was a world record that eclipsed the previous record by 21 3 / 4 inches . The jump still stands as an Olympic record , and stood as a world record until Mike Powell leapt 29 ' 4 1 / 2 `` at the 1991 World Championships in Tokyo .",Beamon's jump was a world record that eclipsed the previous record by 21 3 / 4 inches.The jump still stands as an Olympic record and stands as a world record until Mike Powell stepped 29'4 1 / 2  at the 1991 World Championships in Tokyo.,QA
RTE1_dev.column_s1_122,"The Daily Telegraph , most prized asset in Lord Conrad Black 's crumbling media empire , has been sold to Britain 's Barclay twins .","The Daily Telegraph, the most valuable asset in Lord Conrad Black's crumbling media empire, was sold to Britain's Barclay twins.","The Daily Telegraph, the most valuable asset in Lord Conrad Black's crumbling media empire, has been sold to Britain's Barclay twins.","The Daily Telegraph, the most valued asset in Lord Conrad Black's crumbling media empire, has been sold to Britain's barclay twins.",IR,RTE3_dev.column_s1_32,"Carl Smith collided with a concrete lamp-post while skating and suffered a skull fracture that caused a coma . When he failed to regain consciousness , his parents on August 8 consented to his life support machine being turned off .","Carl Smith collided with a concrete lamp post during skating and suffered a skull fracture causing coma, and his parents consented to turning off his life support machine on August 8, when he failed to regain consciousness.",IE
RTE1_dev.column_s1_580,"The program will include Falla 's `` Night in the Gardens of Spain , '' Ravel 's Piano Concerto in G , Berlioz 's Overture to `` Beatrice and Benedict , '' and Roy Harris ' Symphony No. 3 .","The program will include Falla's  Night in the Gardens of Spain '', Ravel's piano concerto in G, Berlioz's overture to  Beatrice and Benedict '', and Roy Harris'Symphony No. 3.","The program will include Falla's  Night in the Gardens of Spain '', Ravel's piano concerto in G, Berlioz's overture to  Beatrice and Benedict, '' and Roy Harris'Symphony No. 3.","The program will include Falla's  Night in the Gardens of Spain, Ravel's Piano Concerto in G, Berlioz's Overture to  Beatrice and Benedict '' and Roy Harris'Symphony no. 3.",QA,RTE3_dev.column_s1_506,The planet probably got this name due to its red color ; Mars is sometimes referred to as ' the Red Planet ' .,"The planet likely got this name from its red color, Mars is sometimes referred to as'The Red Planet '.",QA
RTE3_dev.column_s1_365,"The mystery of Alexander the Great 's tomb still has not unraveled , and locating the burial of Alexander seems to have become an impossible mission for archaeologists .","The mystery of Alexander the Great's tomb has not yet been unraveled, and finding Alexander's burial seems to have become an impossible mission for archaeologists.",The mystery of Alexander the Great's tomb has not yet unraveled and locating the burial of Alexander seems to have become an impossible task for archaeologists.,The mystery of Alexander the Great's tomb has not yet been unraveled and finding the burial of Alexander seems to have become an impossible mission for archaeologists.,IR,RTE3_dev.column_s1_409,"George H.W. Bush served this country not only as President but also as Vice President , Member of Congress , United Nations Ambassador , chief of the U.S. Liaison Office to the People 's Republic of China , Director of the Central Intelligence Agency and also , as a naval aviator in World War II . Coming back from the war , he married his sweetheart , Barbara Pierce of Rye , New York , and later that year made his first civilian adult decision when he made the appropriate choice of moving to Texas , where he lived the rest of his life .","Bush was President not only, but also as Vice President, Member of Congress, United Nations Ambassador, Director of the U.S. Liaison Office to the People's Republic of China, Director of the Central Intelligence Agency and also as an aircraft pilot in World War II. Having returned from the war, he married his sweetheart Barbara Pierce of Rye, New York, and later that year made his first civilian adult decision when he made the appropriate choice of moving to Texas ",QA
RTE1_dev.column_s1_78,Clinton 's new book is not big seller here .,Clinton's new book is not here to become a big seller.,Clinton's new book is not big seller here.,The new book by Clinton is not a big seller here.,IR,RTE3_dev.column_s1_431,"`` These new results from Cassini may be the first evidence of gases originating either from the surface or possibly from the interior of Enceladus , '' said Dr. Michele Dougherty , principal investigator for the Cassini magnetometer and professor at Imperial College in London . Scientists have suspected Enceladus as geologically active and a possible source of Saturn 's icy E ring . Enceladus is the most reflective object in the solar system , reflecting about 90 percent of the sunlight that hits it .","Scientists believe these new results from Cassini may be the first evidence of gases originating either from the surface or possibly from the interior of Enceladus. Enceladus is the most reflective object in the solar system, reflecting about 90 percent of the sunlight that hits it.",QA
RTE1_dev.column_s1_614,"In naming Guillermo Ortiz to be Mexico 's finance minister , President Ernesto Zedillo appointed a friend , former colleague and , like himself , a U.S. - trained economist .","President Ernesto Zedillo appointed Guillermo Ortiz as Mexico's Finance Minister to honor a friend, former colleague and as a U.S.-like economist.","President Ernesto Zedillo appointed Guillermo Ortiz as Mexico's finance minister, a friend, a former colleague and, like himself, a U.S.-accredited economist.","When he named Guillermo Ortiz as the finance minister of Mexico, President Ernesto Zedillo appointed a friend, former colleague, and an economist trained in the United States as a friend.",QA,RTE3_dev.column_s1_542,"Even while accepting the Russian plan , IMF Managing Director Michel Camdessus noted that the efficiency of Russia 's State Taxation Service `` is declining rapidly . ''","Even while the IMF's managing director Michel Camdessus accepts the Russian plan, he noted that the efficiency of Russia's State Taxation Service  is slowly declining.",QA
