sen1_origin_id,sentence1,sen1_paraphrase0,sen1_paraphrase1,sen1_paraphrase2,sen1_task,sen2_origin_id,sentence2,sen2_paraphrase0,sen2_task
RTE2_test.column_s2_409,The raid just after Friday prayers left three people dead .,"Three people died in the raid at Sunday prayers, just after Friday prayers.",The raid just after the sacrament Sunday morning left three people dead.,The raid left three dead just after Friday's prayers.,SUM,RTE3_test.column_s1_20,"During Reinsdorf 's 24 seasons as chairman of the White Sox , the team has captured American League division championships three times , including an AL Central title in 2000 .","During Reinsdorf's 24 seasons as chairman of the White Sox, the team has won American League division championships three times, including a 2000 AL Central title.",IE
RTE3_test.column_s2_507,Mohammad Khalifa 's father-in-law is Osama Bin Laden .,The father-in-law of Mohammad Khalifa is Osama Bin Laden.,Osama bin Laden is Mohammad Khalifa's father - in-law.,Osama Bin Laden is Mohammad Khalifa's father-in-law.,QA,RTE3_test.column_s1_598,The 16 NATO members and the 14 countries which used to form the rival Warsaw Pact agreed that there would be significantly less equipment permitted in the area of application in Europe than there was under the original treaty .,The 16 NATO member countries and the 14 countries that formed the rival Warsaw Pact agreed that there would be significantly less equipment permitted in the area of application in Europe than was under the original agreement.,QA
RTE3_test.column_s2_277,Overseas tobacco sales increase .,Sales increase to tobacco sales out of the overseas.,Revenues for overseas tobacco increase.,More tobacco sales increase over the overseas.,IR,RTE2_test.column_s1_8,"Mangla was summoned after Madhumita 's sister Nidhi Shukla , who was the first witness in the case .","Mangla was summoned following Madhumita's sister Nidhi Shukla, who was the first witness in the case.",IE
RTE1_test.column_s2_550,Two sides near agreement on Chechnya 's fate .,Two sides close to agreement over Chechnya's fate.,Two sides near agreement on Chechnya's fate.,Two sides near agreement on the fate of Chechnya.,IR,RTE3_test.column_s1_545,"Over 30 women had also left their marks on the world 's highest peak , among them Junko Tabei of Japan , the pioneer who climbed successfully in May , 1975 .","Over 30 women have also left their mark on the highest mountain in the world, including Junko Tabei from Japan, the pioneer who successfully climbed in May 1975.",QA
RTE2_test.column_s2_116,The Labor Department raises the new-job number .,The Labor Department raises the job number to New.,The Labor Department raises the number of new jobs.,The Labor Department raises the new job number.,SUM,RTE3_test.column_s1_163,President Vinicio Cerezo has tacitly blamed President Alfredo Cristiani 's administration for the crisis which prevails in El Salvador as a result of the Farabundo Marti National Liberation Front 's ( FMLN ) offensive which was launched on Saturday 11 November .,"President Vinicio Cerezo has taintedly blamed President Alfredo Cristiani's administration for the crisis in El Salvador as a result of the Farabundo Marti National Liberation Front's ( FMLN ) offensive which was launched on November 11, 2001.",IE
RTE3_test.column_s2_59,The matador 's `` suit of lights '' was invented by Nudie Cohn .,Nudie Cohn invented the  suit of lights '' of Matador.,Nudie Cohn invented the  suit of lights '' of the matador.,Nudie Cohn invented the matador's  suit of lights ''.,IE,RTE1_test.column_s1_760,"The Alameda Central , west of the Zocalo , was created in 1592 .","The Alameda Central, situated west of the Zocalo, was conceived in 1592.",CD
RTE3_test.column_s2_547,The catastrophe at Chernobyl happened in 1986 .,The Chernobyl disaster in 1986 happened.,The 1986 Chernobyl - catastrophe happened.,"In 1986, the Chernobyl catastrophe occurred.",QA,RTE1_test.column_s1_1901,Teenage sensation Wayne Rooney powered England into the quarter-finals of Euro 2004 with two goals in Monday 's 4-2 defeat of Croatia and they were joined in the last eight by champions France who beat Switzerland 3-1 .,"Teenage sensation Wayne Rooney powered England into the quarter-finals of Euro 2004 with two goals in Croatia's 4-2 defeat Monday, and was joined by champions France, who defeated Switzerland 3-1.",IE
RTE1_test.column_s2_1814,Election postponed,Election postponed postponed after election postponed.,Postponed election postponed due to political instability.,Election postponed to August 16th.,IR,RTE1_test.column_s1_2149,Some neighbors said they were forced to break windows to enter the supermarket because the doors would n't open .,Some neighbors said they were forced to break windows in the supermarket because the doors wouldn't open.,CD
RTE2_test.column_s2_646,Tokyo 's High Court approves an appeal for compensation by 10 Chinese survivors .,The High Court of Tokyo took a court order to award compensation to 10 Chinese survivors.,Tokyo's High Court approves an appeal for compensation made by 10 Chinese survivors.,The Tokyo High Court rules on a appeal to the compensation of 10 Chinese survivors.,IE,RTE3_test.column_s1_297,"It took another 22 years on the long road to the talks table until the first Ceasefire Declaration on August 31 st , 1994 was announced by the IRA . This marked the beginning of the Peace Process in Northern Ireland , which in April 1998 resulted in an `` Agreement covering civil rights issues and relationships '' .","It took another 22 years to get to the talks table on the long road to achieve a peace agreement, which marked the beginning of the peace process in Northern Ireland, which resulted in an  agreement about civil rights issues and relationships in April 1998 ''.",IR
RTE1_test.column_s2_1860,Sharon praised France for ' determined action ' against anti-Semitism .,Sharon praised France for's'determined action against Anti-Semitism.,Sharon praised France for's'determined action'against antisemitism.,Sharon praised France for's'decisive action against anti-Semitism.,CD,RTE2_test.column_s1_198,"Some 420 people have been hanged in Singapore since 1991 , mostly for drug trafficking , an Amnesty International 2004 report said . That gives the country of 4.4 million people the highest execution rate in the world relative to population .","Some 420 people were hanging in Singapore since 1991, mostly for drug trafficking, according to a 2004 report of Amnesty International, which gave the country of 4.4 million people the highest execution rate in the world relative to population.",IE
RTE2_test.column_s2_569,Roger Federer battled past Andre Agassi in five sets .,Roger Federer met Andre Agassi in five sets.,Roger Federer fought back on five sets against Andre Agassi.,Roger Federer snatched five sets past Andre Agassi.,SUM,RTE2_test.column_s1_615,"The Council of Europe has 45 member states . Three countries from outside Europe ( Canada , Israel and Mexico ) have observer status in the Parliamentary Assembly .","The Council of Europe has 45 member states, three outside Europe ( Canada, Israel and Mexico ) are observers in the Parliamentary Assembly.",QA
RTE1_test.column_s2_1365,Japan is the world 's prime consumer of whale meat .,Japan is the world's prime consumer of whale meat.,Japan is the world's leading consumer of whale meat.,Japan is the largest consumer of whale meat in the world.,CD,RTE3_test.column_s1_411,"The big-budget Hollywood movie `` The Aviator '' and the low-budget Brit flick `` Vera Drake '' have scooped the main prizes at the 2005 Orange BAFTA Film Awards . Four gongs went to `` The Aviator '' with the top ones being Best Film and Cate Blanchett for Best Supporting Actress . `` Vera Drake '' got three gongs with Best Director , Best Actress and Costume Design . Jamie Foxx got Best Actor with Ray and Clive Owen got Best Supporting Actor with Closer .","The big budget Hollywood - movie  The Aviator '' and the low budget - Brit - film  Vera Drake '' have won the main prizes at the Orange BAFTA Film Awards 2005. Four gongs went to  The Aviator '' with the best films and Cate Blanchett for Best Supporting Actress.  Vera Drake '' got three gongs with Best Director, Best Actress and Costume Design. Jamie Foxx got Best",QA
RTE3_test.column_s2_470,Cyrillic is a Window 's program .,Cyrillic is a window's program.,Cyrillic is a program of Windows.,Cyrillic is a Windows program.,QA,RTE3_test.column_s1_599,"Alluding to Greece 's proposal , and other differences within the alliance , Albright said `` there are a variety of ideas '' among the diverse 19 NATO member nations .","Alluding to Greece's proposal, and other differences within the alliance, Albright said  there are a variety of ideas among the 19 NATO members ''.",QA
RTE3_test.column_s2_140,Omar resided in the Small Heath neighborhood .,Omar lived in the small neighborhood of the Heath.,Omar lived in the Small Heath neighborhood.,"In the Small Heath neighborhood, Omar lived.",IE,RTE1_test.column_s1_822,Satomi Mitarai died of blood loss .,Satomi Mitarai died from blood loss.,CD
RTE1_test.column_s2_1597,Nelson Mandela 's autobiography is called `` The Long Walk to Freedom '' .,Nelson Mandela's autobiography is called '' The Long Walk to Freedom ''.,Nelson Mandela's autobiography  The Long Walk to Freedom '' is called.,Nelson Mandela's autobiography is called  The Long Walk to Freedom ''.,QA,RTE2_test.column_s1_68,"Japan 's economy is definitely not booming but there is a sign of recovery as the export is increasing . However , the decrease of motor vehicle export to North America shows caution .","Japan's economy is certainly not booming, but there is a sign of recovery as exports are increasing but the decrease of the motor vehicle export to North America shows caution.",IR
RTE2_test.column_s2_725,U.S. industry is exported .,Exports are exported from the U.S.,Exportation of U.S. industry is made.,Exports of the U.S. industry are exported.,IR,RTE2_test.column_s1_183,"The announcement at NASA headquarters in Washington confirmed decades of mounting evidence that water once flowed in abundance on Mars , now a frigid and dry planet pocked with craters .","The announcement at NASA headquarters in Washington confirmed decades of mounting evidence that water flowed in abundance once on Mars, a crater - carved, icy and dry planet.",SUM
RTE2_test.column_s2_295,Destruction of the rainforest affects the world 's weather .,Destruction of rainforest affects the weather of the planet.,Destruction of the rainforest affects the world's weather.,Destruction of rainforest affects weather worldwide.,IR,RTE1_test.column_s1_1004,Infertile women are vital for successful child-rearing despite being unable to produce children themselves .,"Infertile women are vital for a successful child-rearing, despite not being able to raise children themselves.",RC
RTE1_test.column_s2_932,Oil prices drop,Oil prices drop as prices drop.,Oil prices drop sharply as prices for oil drop.,Oil prices drop because oil prices drop.,IR,RTE2_test.column_s1_491,"The original Band Aid featured artists including Duran Duran , U 2 , Sting and George Michael , selling 3.5 million copies in the UK alone to raise money for the Ethiopia famine .","The original bandaid featured artists such as Duran Duran, U 2, Sting and George Michael. He sold 3.5 million copies in the UK alone to raise money for the Ethiopia famine.",SUM
RTE1_test.column_s2_1290,"Describing the scene , Dalako Salwati ( 19 ) said that everybody was panic stricken .","Dalako Salwati ( 19 ), who described the scene, said that everyone was panic stricken.",Dalako Salwati ( 19 ) describing the scene said everyone was panicked.,"Dalako Salwati ( 19 ) described the scene, saying that everyone was panic stricken.",MT,RTE2_test.column_s1_638,La Paz department police authorities have disclosed that investigations into the murder of two young U.S. Citizens are being conducted by a specialized group ( not further identified ) summoned specially to clarify this crime .,"Investigations into the murder of two young Americans, conducted by a special group ( not further identified ) is being conducted specially to clarify this crime.",IE
RTE3_test.column_s2_202,New buildings have been erected in Berlin .,New buildings have been built in Berlin.,Berlin erected new buildings.,"In Berlin, new buildings have been built.",IR,RTE1_test.column_s1_2082,Microsoft was established in Italy in 1985 .,Microsoft was founded in 1985 in Italy.,QA
RTE1_test.column_s2_2049,Five other soldiers have been demanded to face courts-martial .,Five other soldiers have been demanded to face court martial.,Five other soldiers have been requested to face court-martial.,Five other soldiers have been ordered to face courts martial.,PP,RTE3_test.column_s1_575,"The 8,568-meter Mt . Kanchenjunga , the third highest in the world , is located in the border area of Nepal , India and China .","The 8,568-meter high mountain Kanchenjunga, the third highest in the world, is located in the border between Nepal, India, and China.",QA
RTE1_test.column_s2_1827,The U.S. detained four frenchmen for almost three years at Guantanamo Bay .,The U.S. has detained four French men for almost three years at Guantanamo Bay.,The U.S. held four Frenchmen in Guantanamo Bay for almost three years.,4 Frenchmen detained at Guantanamo Bay for almost three years are held in the U.S.,RC,RTE1_test.column_s1_116,"Statistically , anorexia strikes more than one in every 100 teen-age girls and young women .",Anaorexia affects statistically more than one in every 100 teen girls and young women.,IR
RTE1_test.column_s2_1964,London Underground opposed to withdraw the poster .,London Underground opposed to withdrawing the poster.,London Underground opposed withdrawal of the poster.,"London Underground, opposed to the poster's withdrawal.",PP,RTE2_test.column_s1_131,"On the same day last week that Mahmoud Ahmadi-Nejad , Iran 's fundamentalist president , called for Israel to be `` wiped off the map '' at an anti-Zionist conference in Tehran , his first vice-president was attending a different sort of event in Moscow .","On the same day last week, when Iran's fundamentalist president Mahmoud Ahmadi-Nejad called for Israel to be  wiped from the map  at an anti-Zionist conference in Tehran, his first vice-president a different kind of event was held in Moscow.",IE
RTE2_test.column_s2_70,India 's Meteorological Department operates from Indonesia .,The meteorological department of India operates from Indonesia.,India's meteorological department operates from Indonesia.,The Meteorological Department in India works from Indonesia.,IE,RTE3_test.column_s1_490,"Gurkhas are pretty mild-mannered , polite and rather shy folks . In fact most villagers from those hill-regions ( Garhwalis , Kumounis , Dogras etc. ) are all pretty gentle people , even though they have a long and distinguished history of military service .","In fact, most villagers from those hill regions ( garhwalis, Kumounis, Dogras etc. ) are pretty gentle people even though they have a long and distinguished history of military service.",QA
RTE3_test.column_s2_690,"Sotheby 's , Christie 's and Phillips founded the ALR .","The ALR was founded by Sotheby, Christie and Phillips.","The ALR was founded by Sotheby's, Christie's and Phillips.","Sotheby's, Christie's and Phillips founded the ALR.",SUM,RTE2_test.column_s1_281,"ECB spokeswoman , Regina Schueller , declined to comment on a report in Italy 's la Repubblica newspaper that the ECB council will discuss Mr. Fazio 's role in the takeover fight at its Sept. 15 meeting .","Regina Schueller, an ECB spokeswoman, declined to comment on a report in Italy's newspaper la Repubblica, that the ECB Council would discuss Mr. Fazio's role in the takeover - fight at its September 15 meeting.",IE
RTE3_test.column_s2_770,"More than 1,000 members from Russia registered for the news conference .","More than 1,000 members from Russia entered the news conference.","More than 1,000 Russian members attended the news conference.","The news conference was attended by more than 1,000 members from Russia.",SUM,RTE3_test.column_s1_707,In England Salvation Army social workers and volunteers have been trained in outreach work to make contact with homeless people on the streets .,In England Salvation Army social workers and volunteers have been trained in outreach to put the homeless people on the street.,SUM
RTE1_test.column_s2_828,Jennifer Hawkins is Australia 's 20-year-old beauty queen .,Jennifer Hawkins is the 20-year-old beauty queen of Australia.,Jennifer Hawkins is Australia's 20-year-old beauty queen.,Jennifer Hawkins is the 20-year-old beauty queen in Australia.,CD,RTE1_test.column_s1_1353,"The parties , which Zeroual consulted during the past few weeks , had expressed their desire to postpone the elections , arguing that the interval given by the president until the end of February was very short .","The parties that Zeroual consulted in the last few weeks had expressed their desire to postpone the elections, arguing that the interval granted by the president to the end of February was very short.",MT
RTE2_test.column_s2_467,Cars exported by Japan decreased .,"During the past decade, car exports from Japan decreased.",Cars exported by Japan were decreasing.,Exports from Japan of cars decreased.,IR,RTE3_test.column_s1_751,"Bush and Clinton , who ran against each other in 1992 , have worked together since leaving office . They helped raise funds for recovery from 2004 's Asian tsunami and 2005 's Hurricane Katrina .","Since leaving office, Bush and Clinton, who ran against each other in 1992, have worked together to recover funds from the Asian tsunami of 2004 and Hurricane Katrina of 2005.",SUM
RTE2_test.column_s2_657,A bomb blew up close to Hariri 's motorcade in Beirut on Monday .,A bomb blew up in Beirut on Monday near Hariri's motorcade.,"On Monday, a bomb hit near the motorcade of Hariri in Beirut.","On Monday, a bomb blew up near Hariri's motorcade in Beirut.",SUM,RTE3_test.column_s1_353,"Women 's Hub is a Philippines-based non-government organisation that supports `` women struggling for self-determination '' in using ICTs , or information and communication technologies .",Women's Hub is a non-government organization based in the Philippines that supports  women struggling for self-determination '' in using ICTs or information and communications technologies.,IR
RTE1_test.column_s2_2167,Microsoft to begin shipping major update to Windows,Microsoft is to begin shipping major update to Windows with Microsoft for Windows XP.,Microsoft to begin shipping large update to Windows.,Microsoft will start delivering important update to Windows after Microsoft has released Windows 10,CD,RTE1_test.column_s1_2157,Combined with oil prices still hovering near $ 44 a barrel .,"Together with oil prices still edging around $ 44 a barrel, is combined.",CD
RTE1_test.column_s2_277,U.N. has imposed sanctions against Haiti .,U.N. sanctions against Haiti have been imposed against Haiti.,U.N. sanctions against Haiti have been lifted.,U.N. sanctions against Haiti have been imposed on Haiti.,IR,RTE2_test.column_s1_328,"Commissioner Gary Bettman announced Wednesday that players will be locked out starting Thursday , leaving the upcoming season in jeopardy .","Commissioner Gary Bettman announced Wednesday that players will be locked out of action beginning Thursday, putting the upcoming season in danger.",SUM
RTE1_test.column_s2_1322,Cohen supports force in making Iraq disarm .,Cohen supports force in enabling Iraq to disarm.,Cohen supports force in disarming Iraq.,Cohen supports the use of force in Iraq to.,MT,RTE2_test.column_s1_184,"President Bush briefly and vaguely alluded to stem-cell research and cloning during his State of the Union address , instigating much speculation on what to expect in 2005 .","During his State of the Union Address, President Bush was briefly and vaguely referred to stem cell research and cloning, instigating much speculation about what to expect in 2005.",SUM
RTE2_test.column_s2_53,Filmmaker Michael Moore was all smiles after winning top honors at the People 's Choice Awards .,Michael Moore was all smiles after winning the top honours at the People's Choice Awards.,Filmmaker Michael Moore was all smiles after receiving top honors at the People's Choice Awards.,Filmmaker Michael Moore was smiling after he won top honours at the People's Choice Awards.,SUM,RTE2_test.column_s1_555,"Mickelson finished a triumphant week in his second home , winning the FBR Open by five strokes for his largest margin of victory in a PGA Tour event .",Mickelson finished a triumphant week in his second home and won the FBR Open with five strokes for his biggest margin of victory in a PGA Tour event.,SUM
RTE3_test.column_s2_549,The catastrophe at Chernobyl happened in 1986 .,The Chernobyl Disaster in 1986 happened.,The 1986 disaster at Chernobyl happened in 1986.,The Chernobyl disaster was in 1986.,QA,RTE3_test.column_s1_564,"It fell apart when steamy French actress Sophie Marceau emerged to present the Palme D 'Or , or Golden Palm , to Belgium 's `` Rosetta . ''","It fell apart when the steamy French actress Sophie Marceau appeared to give Belgium's  Rosetta the Palme D 'Or, or Golden Palm.",QA
RTE2_test.column_s2_671,Lleyton Hewitt had a win over Andy Roddick in Friday 's semi-final .,Lleyton Hewitt had a victory over Andy Roddick in the semi-finals on Friday.,"In the semi-final on Friday, Lleyton Hewitt had a victory over Andy Roddick.",Lleyton Hewitt won in the semi-final at Andy Roddick's by winning on Friday.,SUM,RTE3_test.column_s1_645,"Indonesia 's tin industry is expected to return to profit in 1992 with the dominant state-owned tin mine , Tambang Timah , having cut production costs by 25 per cent since 1990 .","Indonesia's tin industry is expected to return to profit in 1992, with the dominant state-owned tin mine, Tambang Timah, which has rerun production costs by 25 per cent since 1990.",SUM
RTE3_test.column_s2_740,Campfire helps rural communities make money from animals which had been poached as pests .,Campfire helps rural communities to make money from the animals which were poached as pests.,Campfire helps rural communities with wild animals that had been slaughtered as pests make money.,Campfire helps rural communities make money from animals that were poached as pests.,SUM,RTE3_test.column_s1_491,The world famous Gurkhas come from the high mountains of Nepal .,The famous Gurkhas come from the Nepalese high mountains.,QA
RTE2_test.column_s2_326,Tutankhamun 's Tomb was unearthed by Howard Carter and Lord Carnarvon .,Tomb of Tutankhamun was discovered by Howard Carter and Lord Carnarvon.,Howard Carter and Lord Carnarvon uncovered Tutankhamun's Tomb.,Tutankhamun's tomb was discovered by Howard Carter and Lord Carnarvon.,QA,RTE1_test.column_s1_2122,Iraq claimed Tuesday to have shot down a second U.S. spy plane in less than a month .,Iraq claimed Tuesday that it had shot down in less than a month a second U.S. spy plane.,IR
RTE2_test.column_s2_405,The pope 's name is Peter .,The name of the pope is Peter.,The name of Peter is Peter.,The pope is Peter's name.,QA,RTE1_test.column_s1_2054,"The $ 100,000 award , to be presented to Taylor in May by the president of Israel , is one of six given annually by the Israel-based Wolf Foundation .","The $ 100,000 award, which Taylor will receive in May by the President of Israel, is one of six each year given by the Israel-based Wolf Foundation.",QA
RTE1_test.column_s2_1421,The Gaza unrest spurred Ahmed Qurei into quitting .,The Gaza Unrest has spurred Ahmed Qurei to quit.,The unrest in Gaza spurred Ahmed Qurei to quit.,The Gaza unrest spurred Ahmed Qurei to quit.,PP,RTE2_test.column_s1_556,"Tampa-based Odyssey Marine Exploration , which was poised this spring to start archaeological and treasure recovery work on what it believes to be the more than 300-year-old shipwreck , has put the project on hold after last-minute objections from Andalusia .","Odyssey Marine Exploration, which was scheduled to begin archaeological and treasure recovery work in the spring of this year on what it believes to be a 300-year-old shipwreck, has put the project on hold after last-minute objections from Andalusia.",IR
RTE1_test.column_s2_1424,Mr Arafat 's opponents appealed to him to stop the mounting lawlessness in the Palestinian territories .,Mr Arafat's opponents appealed to him to stop the growing lawlessness in the Palestinian territories.,The opponents of Mr Arafat's appealed to him to stop the rising illegality in the Palestinian territories.,Mr Arafat's opponents appealed to him to stop the rising lawlessness in the Palestinian territories.,PP,RTE3_test.column_s1_752,Unwrapping a new version of Microsoft 's now-standard Windows operating system is generally an event of major proportions .,Unwrapping a new version of Microsoft's now standard Windows operating system is generally an event of major proportions.,SUM
RTE2_test.column_s2_258,Many parts of tsunami-battered Aceh province were not safe for the military .,"Many parts of the Aceh province, which had been evacuated by tsunami, were not safe for military.","Many parts of the Aceh province, a tsunami-stricken region, were not safe for the military.","Many parts of the deadly Aceh province, which was hit by tsunami, were not safe for the military.",SUM,RTE1_test.column_s1_1328,"Despite these differences , nothing prevents a Portuguese , for example , from buying a sandwich in front of the Eiffel Tower with an Euro coin bearing the Austrian flowers .","Despite these differences, nothing prevents a Portuguese, for example, from buying a sandwich with an Euro coin that carries Austrian flowers near the Eiffel Tower.",MT
